Question,Answer
What is AI?,Artificial Intelligence is the simulation of human intelligence by machines.
What is Machine Learning?,Machine Learning is a subset of AI that enables systems to learn from data.
What is Python?,Python is a popular programming language used for AI and web development.
Who developed Python?,Python was created by Guido van Rossum.
What is Flask?,Flask is a lightweight Python web framework.
What is NLP?,Natural Language Processing helps computers understand human language.
What is Deep Learning?,Deep Learning is a subset of Machine Learning based on neural networks.
What is ChatGPT?,ChatGPT is an AI chatbot developed by OpenAI.